{
  "artifact_paths": {
    "metadata_file": "target/benchmark/full/metadata.json",
    "raw_samples_dir": "target/benchmark/full/raw"
  },
  "commit": "f51671507a148666d5a42f29086d97b3d6877f93",
  "features": [],
  "format_version": 1,
  "generated_at_unix_ms": 1786217559003,
  "host_triple": "aarch64-apple-darwin",
  "notes": "Non-blocking harness evidence. Framework-only conformance path; no external model latency.",
  "package": "finstack-ai-test",
  "platform": {
    "machine": "arm64",
    "release": "25.5.0",
    "system": "Darwin"
  },
  "profile": "bench",
  "rustc": "rustc 1.97.1 (8bab26f4f 2026-07-14)",
  "sample_settings": {
    "measurement_time_secs": 1.0,
    "sample_size": 20,
    "warm_up_time_secs": 0.3
  },
  "target": "aarch64-apple-darwin",
  "workload": "conformance-noop-load-normalize-compare"
}
